{
  "$schema": "https://json-schema.org/draft/2020-12/schema",
  "$id": "https://agenteval.dev/aef/1/reader/runner.schema.json",
  "title": "AEF 1.0: runner capability manifest",
  "description": "READER (tolerant), derived from the writer schema by tools/derive_reader.py. What a runner is and can do: its identity, kind, platform, the providers it supports, its tags and the target modes it can give. A plan's runnerSelector is matched against the tags.",
  "type": "object",
  "required": [
    "schemaVersion",
    "runnerId",
    "kind",
    "os",
    "runtime",
    "providers",
    "tags",
    "version"
  ],
  "properties": {
    "schemaVersion": {
      "$ref": "common.schema.json#/$defs/schemaVersion",
      "description": "The AEF version this document follows, MAJOR.MINOR: 1.0 for AEF 1.0 (VER-1)."
    },
    "runnerId": {
      "$ref": "common.schema.json#/$defs/id",
      "description": "The runner's id; the events and runs it produces name it (PLAN-6)."
    },
    "identity": {
      "description": "The runner's workload identity, and the id of the key it signs sealed evidence with, if any.",
      "type": "object",
      "required": [
        "workloadId"
      ],
      "properties": {
        "workloadId": {
          "description": "The runner's workload identity (PLAN-6).",
          "type": "string",
          "minLength": 1,
          "maxLength": 256
        },
        "signingKeyId": {
          "description": "The id of the key the runner signs sealed evidence with: a hint for a reader, never a reason to trust the key (PLAN-6, SIG-4).",
          "type": "string",
          "minLength": 1,
          "maxLength": 256
        }
      }
    },
    "kind": {
      "description": "What the runner is: local (a local process), remote (a remote service), ci (a CI job) or pool (a pool of runners) (PLAN-6).",
      "type": "string"
    },
    "os": {
      "description": "The runner's operating system: linux, windows or macos (PLAN-6).",
      "type": "string"
    },
    "runtime": {
      "description": "The runtime the runner runs on (PLAN-6).",
      "type": "object",
      "required": [
        "name",
        "version"
      ],
      "properties": {
        "name": {
          "description": "The runtime's name.",
          "type": "string",
          "minLength": 1,
          "maxLength": 64
        },
        "version": {
          "description": "The runtime's version.",
          "type": "string",
          "minLength": 1,
          "maxLength": 64
        }
      }
    },
    "providers": {
      "description": "The providers the runner supports. It refuses a plan whose provider is not among them (PLAN-7).",
      "type": "array",
      "minItems": 1,
      "maxItems": 16,
      "items": {
        "$ref": "common.schema.json#/$defs/provider"
      }
    },
    "tags": {
      "description": "The runner's tags. It can take a plan only when it carries every tag of the plan's runnerSelector (PLAN-7).",
      "type": "array",
      "maxItems": 64,
      "items": {
        "type": "string",
        "pattern": "^[a-z0-9][a-z0-9._:-]{0,63}$"
      }
    },
    "gpu": {
      "description": "Whether the runner has a GPU (PLAN-6).",
      "type": "boolean"
    },
    "networkZone": {
      "description": "The network zone the runner runs in. A remote-zone plan needs it to be the plan's zone (PLAN-7).",
      "type": "string",
      "pattern": "^[a-z0-9][a-z0-9._:-]{0,63}$"
    },
    "targetModes": {
      "description": "The target modes the runner can give, as run.json's execution.targetMode (RUN-7). A manifest without them gives live only; a runner can take a plan only when its targetMode (live when it has none) is one of them (PLAN-6, PLAN-7).",
      "type": "array",
      "minItems": 1,
      "uniqueItems": true,
      "items": {
        "type": "string"
      }
    },
    "version": {
      "description": "The runner software's version.",
      "type": "string",
      "minLength": 1,
      "maxLength": 64
    },
    "ext": {
      "$ref": "common.schema.json#/$defs/ext",
      "description": "Producer extensions, named reverse-DNS or with the producer's prefix. A reader ignores what it does not know; never holds a secret (ENC-19)."
    }
  }
}
